id,text,favorites,retweets,date,tweet_datetime,date_part,time_part,hour,year,month
1.0556e+18,the service members who died that day included brave young marines just out of high school accomplished officers in the middle of their military careers and enlisted men who had served in theaters all over the world,48731,10748,2018-10-25 23:21:00,2018-10-26 07:21:00,2018-10-26,07:21:00,7,2018,10
1.0556e+18,in roughly marines were in beirut to keep the peace in a nation torn apart by civil war terrorists had bombed the u s embassy earlier that year killing people including americans,40815,9384,2018-10-25 23:19:00,2018-10-26 07:19:00,2018-10-26,07:19:00,7,2018,10
1.0556e+18,we are gathered together on this solemn occasion to fulfill our most reverent and sacred duty years ago american service members were murdered in the terrorist attack on our marine barracks in beirut lebanon today we honor our fallen heroes,56890,13154,2018-10-25 23:13:00,2018-10-26 07:13:00,2018-10-26,07:13:00,7,2018,10
1.05556e+18,from maine is a great congressman he is in a tough fight against a very liberal nancy pelosi democrat bruce has helped bring jobs back to his state and totally protects your great second amendment we need to keep bruce in washington he has my full endorsement,44632,11127,2018-10-25 20:39:00,2018-10-26 04:39:00,2018-10-26,04:39:00,4,2018,10
1.05556e+18,will make a fantastic governor of alaska mike is for energy and jobs is tough on crime loves our vets and our great second amendment mike has my complete and total endorsement,36302,8567,2018-10-25 20:24:00,2018-10-26 04:24:00,2018-10-26,04:24:00,4,2018,10
1.05556e+18,is doing a great job for the people of pennsylvania he is strong on the border crime the military our vets and the nd amendment lloyd has my total endorsement,34285,8278,2018-10-25 20:22:00,2018-10-26 04:22:00,2018-10-26,04:22:00,4,2018,10
1.05542e+18,a very big part of the anger we see today in our society is caused by the purposely false and inaccurate reporting of the mainstream media that i refer to as fake news it has gotten so bad and hateful that it is beyond description mainstream media must clean up its act fast,156496,41327,2018-10-25 11:18:00,2018-10-25 19:18:00,2018-10-25,19:18:00,19,2018,10
1.05541e+18,brandon judd of the national border patrol council is right when he says on that the democrat inspired laws make it tough for us to stop people at the border must be chanded but i am bringing out the military for this national emergency they will be stopped,75825,18178,2018-10-25 11:05:00,2018-10-25 19:05:00,2018-10-25,19:05:00,19,2018,10
1.05541e+18,the socalled experts on trump over at the new york times wrote a long and boring article on my cellphone usage that is so incorrect i do not have time here to correct it i only use government phones and have only one seldom used government cell phone story is soooo wrong,67366,16472,2018-10-25 10:54:00,2018-10-25 18:54:00,2018-10-25,18:54:00,18,2018,10
1.05527e+18,just leaving wisconsin and are fantastic people badly needed for our country,47057,10542,2018-10-25 01:43:00,2018-10-25 09:43:00,2018-10-25,09:43:00,9,2018,10
1.05525e+18,just arrived in wisconsin to help two great people and,58534,12575,2018-10-24 23:54:00,2018-10-25 07:54:00,2018-10-25,07:54:00,7,2018,10
1.05507e+18,we are a great sovereign nation we have strong borders and will never accept people coming into our country illegally,109735,24472,2018-10-24 11:56:00,2018-10-24 19:56:00,2018-10-24,19:56:00,19,2018,10
1.05506e+18,for those who want and advocate for illegal immigration just take a good look at what has happened to europe over the last years a total mess they only wish they had that decision to make over again,110705,29683,2018-10-24 11:52:00,2018-10-24 19:52:00,2018-10-24,19:52:00,19,2018,10
1.05487e+18,i agree with president obama,201214,69222,2018-10-23 23:18:00,2018-10-24 07:18:00,2018-10-24,07:18:00,7,2018,10
1.05239e+18,stock market up points today also great jobs numbers,60648,10975,2018-10-17 02:39:00,2018-10-17 10:39:00,2018-10-17,10:39:00,10,2018,10
1.05459e+18,congressman erik paulsen of the great state of minnesota has done a fantastic job in cutting taxes and job killing regulations hard working and very smart keep erik in congress he has my strong endorsement,53673,12421,2018-10-23 04:22:00,2018-10-23 12:22:00,2018-10-23,12:22:00,12,2018,10
1.05456e+18,we send our deepest condolences to and the entire barletta family on the passing of his brother lou has been working so hard despite this terrible situation for the people of pennsylvania our thoughts and prayers are with lou and the entire barletta family,58784,11599,2018-10-23 02:44:00,2018-10-23 10:44:00,2018-10-23,10:44:00,10,2018,10
1.05456e+18,todays democrat party would rather protect criminal aliens than american citizens which is why the democrats must be voted out of office,53055,14942,2018-10-23 02:30:00,2018-10-23 10:30:00,2018-10-23,10:30:00,10,2018,10
1.05456e+18,at stake in this election is whether we continue the extraordinary prosperity we have achieved or whether we let the radical democrat mob take a giant wrecking ball to our country and our economy,53277,14614,2018-10-23 02:13:00,2018-10-23 10:13:00,2018-10-23,10:13:00,10,2018,10
1.05455e+18,we send our deepest condolences to lou and the entire barletta family he has been working so hard despite this terrible situation for the people of pennsylvania our thoughts and prayers are with you lou,13837,3313,2018-10-23 02:06:00,2018-10-23 10:06:00,2018-10-23,10:06:00,10,2018,10
1.05455e+18,thank you houston texas get out and,53384,13849,2018-10-23 01:30:00,2018-10-23 09:30:00,2018-10-23,09:30:00,9,2018,10
1.05454e+18,,40437,10001,2018-10-23 01:23:00,2018-10-23 09:23:00,2018-10-23,09:23:00,9,2018,10
1.05449e+18,massive crowds inside and outside of the in houston texas landing shortly see everyone soon,57564,13737,2018-10-22 21:35:00,2018-10-23 05:35:00,2018-10-23,05:35:00,5,2018,10
1.05419e+18,ron desantis had a great debate victory tonight against andrew gillum a mayor who presides over one of the worst run and most corrupt cities in florida ron will build on the great job done by governor rick scott gillum will make florida the next venezuela,68046,18879,2018-10-22 01:49:00,2018-10-22 09:49:00,2018-10-22,09:49:00,9,2018,10
1.05414e+18,facebook has just stated that they are setting up a system to purge themselves of fake news does that mean cnn will finally be put out of business,158419,37139,2018-10-21 22:48:00,2018-10-22 06:48:00,2018-10-22,06:48:00,6,2018,10
1.05384e+18,watched north dakotas rep kevin cramer easily win debate with senator heidi heitkamp great job kevin you will be a great senator,80965,16844,2018-10-21 02:45:00,2018-10-21 10:45:00,2018-10-21,10:45:00,10,2018,10
1.05381e+18,all levels of government and law enforcement are watching carefully for voter fraud including during early voting cheat at your own peril violators will be subject to maximum penalties both civil and criminal,121193,36547,2018-10-21 00:36:00,2018-10-21 08:36:00,2018-10-21,08:36:00,8,2018,10
1.05374e+18,beautiful afternoon in elko nevada thank you get out and vote today,42395,9309,2018-10-20 20:12:00,2018-10-21 04:12:00,2018-10-21,04:12:00,4,2018,10
1.05349e+18,beautiful evening in mesa arizona with great patriots thank you,43237,9525,2018-10-20 03:17:00,2018-10-20 11:17:00,2018-10-20,11:17:00,11,2018,10
1.05348e+18,this was outside of the massive totally full hangar tonight in mesa arizona,79082,19681,2018-10-20 03:13:00,2018-10-20 11:13:00,2018-10-20,11:13:00,11,2018,10
1.05346e+18,on my way see you all shortly,47325,9475,2018-10-20 01:23:00,2018-10-20 09:23:00,2018-10-20,09:23:00,9,2018,10
1.05345e+18,wow mesa arizona look forward to joining everyone soon somethings happening,58447,13280,2018-10-20 00:51:00,2018-10-20 08:51:00,2018-10-20,08:51:00,8,2018,10
1.05343e+18,this is what it is all about for the republican party,72724,18886,2018-10-19 23:47:00,2018-10-20 07:47:00,2018-10-20,07:47:00,7,2018,10
1.05312e+18,,83869,23279,2018-10-19 03:23:00,2018-10-19 11:23:00,2018-10-19,11:23:00,11,2018,10
1.05312e+18,jon tester says one thing to voters and does the exact opposite in washington tester takes his orders form pelosi amp schumer tester wants to raise your taxes take away your a open your borders and deliver mob rule retire tester amp elect americafirst patriot matt rosendale,66886,18235,2018-10-19 03:11:00,2018-10-19 11:11:00,2018-10-19,11:11:00,11,2018,10
1.0531e+18,thank you missoula montana get out and vote for and,39963,9468,2018-10-19 01:54:00,2018-10-19 09:54:00,2018-10-19,09:54:00,9,2018,10
1.05308e+18,the only thing keeping tester alive is he has millions and millions of dollars from outside liberals and leftists who couldnt care less about our country,60262,14271,2018-10-19 00:11:00,2018-10-19 08:11:00,2018-10-19,08:11:00,8,2018,10
1.05307e+18,will be landing soon looking forward to seeing our next senator from montana matt rosendale he will represent our country well far better than jon tester who will vote with cryin chuck schumer and nancy pelosi never with us,54086,11047,2018-10-19 00:04:00,2018-10-19 08:04:00,2018-10-19,08:04:00,8,2018,10
1.05307e+18,prime minister of japan has been working with me to help balance out the onesided trade with japan these are some of the investments they are making in our country just the beginning,42258,11704,2018-10-18 23:49:00,2018-10-19 07:49:00,2018-10-19,07:49:00,7,2018,10
1.05306e+18,thank you mexico we look forward to working with you,67736,17930,2018-10-18 22:51:00,2018-10-19 06:51:00,2018-10-19,06:51:00,6,2018,10
1.05303e+18,look forward to being there somethings happening,45592,11233,2018-10-18 21:22:00,2018-10-19 05:22:00,2018-10-19,05:22:00,5,2018,10
1.05301e+18,can you believe this and what democrats are allowing to be done to our country,58126,21485,2018-10-18 20:04:00,2018-10-19 04:04:00,2018-10-19,04:04:00,4,2018,10
1.05289e+18,the assault on our country at our southern border including the criminal elements and drugs pouring in is far more important to me as president than trade or the usmca hopefully mexico will stop this onslaught at their northern border all democrats fault for weak laws,77569,19630,2018-10-18 11:45:00,2018-10-18 19:45:00,2018-10-18,19:45:00,19,2018,10
1.05289e+18,in addition to stopping all payments to these countries which seem to have almost no control over their population i must in the strongest of terms ask mexico to stop this onslaught and if unable to do so i will call up the u s military and close our southern border,130487,32455,2018-10-18 11:35:00,2018-10-18 19:35:00,2018-10-18,19:35:00,19,2018,10
1.05288e+18,i am watching the democrat party led because they want open borders and existing weak laws assault on our country by guatemala honduras and el salvador whose leaders are doing little to stop this large flow of people including many criminals from entering mexico to u s,73296,18813,2018-10-18 11:25:00,2018-10-18 19:25:00,2018-10-18,19:25:00,19,2018,10
1.05274e+18,ever since his vicious and totally false statements about admiral ron jackson the highly respected white house doctor for obama bush amp me senator john tester looks to be in big trouble in the great state of montana he behaved worse than the democrat mob did with justice k,77442,19492,2018-10-18 02:03:00,2018-10-18 10:03:00,2018-10-18,10:03:00,10,2018,10
1.05268e+18,this afternoon it was my great honor to present sergeant major john canley the medal of honor in the east room of the,48843,9501,2018-10-17 22:03:00,2018-10-18 06:03:00,2018-10-18,06:03:00,6,2018,10
1.05253e+18,ted cruz has done so much for texas including massive cuts in taxes and regulations which has brought texas to the best jobs numbers in the history of the state he watches carefully over your nd amendment orourke would blow it all ted has long had my strong endorsement,69540,16469,2018-10-17 12:00:00,2018-10-17 20:00:00,2018-10-17,20:00:00,20,2018,10
1.05253e+18,watched the debate last night amp beto orourke who wants higher taxes and far more regulations is not in the same league with ted cruz amp what the great people of texas stand for amp want ted is strong on crime border amp nd a loves our military vets low taxes beto is a flake,67593,16568,2018-10-17 11:52:00,2018-10-17 19:52:00,2018-10-17,19:52:00,19,2018,10
1.05252e+18,trump could be the most honest president in modern history when you look at the real barometer of presidential truthfulness which is promise keeping he is probably the most honest president in american history hes done exactly what he said he would do marc thiessen wpost,76387,18514,2018-10-17 11:30:00,2018-10-17 19:30:00,2018-10-17,19:30:00,19,2018,10
1.05239e+18,elizabeth warren is being hammered even by the left her false claim of indian heritage is only selling to very low i q individuals,77699,16122,2018-10-17 02:36:00,2018-10-17 10:36:00,2018-10-17,10:36:00,10,2018,10
1.05237e+18,anybody entering the united states illegally will be arrested and detained prior to being sent back to their country,147328,34326,2018-10-17 01:24:00,2018-10-17 09:24:00,2018-10-17,09:24:00,9,2018,10
1.05237e+18,we have today informed the countries of honduras guatemala and el salvador that if they allow their citizens or others to journey through their borders and up to the united states with the intention of entering our country illegally all payments made to them will stop end,116985,29731,2018-10-17 01:19:00,2018-10-17 09:19:00,2018-10-17,09:19:00,9,2018,10
1.05234e+18,i will be interviewed tonight by trish regan on at p m right after the great lou dobbs,38726,6662,2018-10-16 23:43:00,2018-10-17 07:43:00,2018-10-17,07:43:00,7,2018,10
1.05199e+18,together we will prevail,74367,15500,2018-10-16 00:26:00,2018-10-16 08:26:00,2018-10-16,08:26:00,8,2018,10
1.05198e+18,open enrollment starts today on lowerpriced medicare advantage plans so loved by our great seniors crazy bernie and his band of congressional dems will outlaw these plans disaster,66059,16666,2018-10-15 23:51:00,2018-10-16 07:51:00,2018-10-16,07:51:00,7,2018,10
1.0518e+18,the only way to shut down the democrats new mob rule strategy is to stop them cold at the ballot box the fight for americas future is never over ben shapiro,86884,21978,2018-10-15 11:46:00,2018-10-15 19:46:00,2018-10-15,19:46:00,19,2018,10
1.05153e+18,will be interviewed tonight by on at p m eastern enjoy,14066,3645,2018-10-14 06:06:00,2018-10-14 14:06:00,2018-10-14,14:06:00,14,2018,10
1.05132e+18,congratulations to tucker carlson on the great success of his book ship of fools it just went to number one,86743,16528,2018-10-14 03:53:00,2018-10-14 11:53:00,2018-10-14,11:53:00,11,2018,10
1.05132e+18,big day pastor andrew brunson who could have spent years in a turkish prison was returned safely home to his family today met in oval office great people then off to kentucky for a rally for congressman andy barr tremendous crowd amp spirit just returned to white house,76628,13973,2018-10-14 03:42:00,2018-10-14 11:42:00,2018-10-14,11:42:00,11,2018,10
1.05128e+18,thank you kentucky,48352,10438,2018-10-14 01:16:00,2018-10-14 09:16:00,2018-10-14,09:16:00,9,2018,10
1.05122e+18,on my way to richmond kentucky for a make america great again rally at p me the crowds are once again massive see everyone in a couple of hours,40451,7995,2018-10-13 21:06:00,2018-10-14 05:06:00,2018-10-14,05:06:00,5,2018,10
1.05121e+18,welcome home pastor andrew brunson,75642,16340,2018-10-13 20:48:00,2018-10-14 04:48:00,2018-10-14,04:48:00,4,2018,10
1.05121e+18,,44122,9414,2018-10-13 20:42:00,2018-10-14 04:42:00,2018-10-14,04:42:00,4,2018,10
1.05091e+18,beautiful make america great again rally in lebanon ohio thank you watch here,41520,8432,2018-10-13 00:30:00,2018-10-13 08:30:00,2018-10-13,08:30:00,8,2018,10
1.05087e+18,the great football and lacrosse player jim brown outside the west wing of the he is also a tremendous man and mentor to many young people,76568,17527,2018-12-10 22:14:00,2018-12-11 06:14:00,2018-12-11,06:14:00,6,2018,12
1.05023e+18,florida highway patrol troopers are all en route to the panhandle from all across the state of florida to help those affected by if you see them be sure to shake their hands and say thank you,72892,15112,2018-11-10 03:44:00,2018-11-10 11:44:00,2018-11-10,11:44:00,11,2018,11
1.0502e+18,thank you to and all first responders,42208,7926,2018-11-10 01:35:00,2018-11-10 09:35:00,2018-11-10,09:35:00,9,2018,11
1.0502e+18,thank you jacksonville sheriffs office,41193,8416,2018-11-10 01:33:00,2018-11-10 09:33:00,2018-11-10,09:33:00,9,2018,11
1.05019e+18,massive overflow crowd tonight in erie pennsylvania thank you to everyone who came out and joined us together we are making america great again,80164,19285,2018-11-10 01:00:00,2018-11-10 09:00:00,2018-11-10,09:00:00,9,2018,11
1.05019e+18,thank you erie pennsylvania remember to get out and vote,39954,8989,2018-11-10 00:52:00,2018-11-10 08:52:00,2018-11-10,08:52:00,8,2018,11
1.05013e+18,couldnt let these great people down they have been lined up since last night see you soon pennsylvania,46502,9431,2018-10-10 21:01:00,2018-10-11 05:01:00,2018-10-11,05:01:00,5,2018,10
1.04983e+18,thank you iowa amp nebraska vote vote vote,46985,10671,2018-10-10 01:23:00,2018-10-10 09:23:00,2018-10-10,09:23:00,9,2018,10
1.04983e+18,,29554,6445,2018-10-10 01:18:00,2018-10-10 09:18:00,2018-10-10,09:18:00,9,2018,10
1.04978e+18,has been relentless in securing the funding to fix the algae problem from lake okeechobee we will solve this congress must follow through on the governments plan on the everglades reservoir bill nelson has been no help,49708,11909,2018-09-10 21:39:00,2018-09-11 05:39:00,2018-09-11,05:39:00,5,2018,9
1.04947e+18,,63885,14527,2018-09-10 01:34:00,2018-09-10 09:34:00,2018-09-10,09:34:00,9,2018,9
1.04945e+18,,50703,12109,2018-08-10 23:43:00,2018-08-11 07:43:00,2018-08-11,07:43:00,7,2018,8
1.04256e+18,great new book by jason chaffetz appropriately called the deep state very interesting indeed,70405,15705,2018-09-19 23:57:00,2018-09-20 07:57:00,2018-09-20,07:57:00,7,2018,9
1.04875e+18,you dont hand matches to an arsonist and you dont give power to an angry leftwing mob democrats have become too extreme and too dangerous to govern republicans believe in the rule of law not the rule of the mob vote republican,197487,56668,2018-07-10 01:21:00,2018-07-10 09:21:00,2018-07-10,09:21:00,9,2018,7
1.04874e+18,beautiful evening in topeka kansas vote vote vote,59267,12173,2018-07-10 01:15:00,2018-07-10 09:15:00,2018-07-10,09:15:00,9,2018,7
1.04874e+18,thank you kansas i love you,62788,12453,2018-07-10 00:49:00,2018-07-10 08:49:00,2018-07-10,08:49:00,8,2018,7
1.04869e+18,the crowd in front of the u s supreme court is tiny looks like about people amp most are onlookers that wouldnt even fill the first couple of rows of our kansas rally or any of our rallies for that matter the fake news media tries to make it look sooo big amp its not,139024,29995,2018-06-10 21:57:00,2018-06-11 05:57:00,2018-06-11,05:57:00,5,2018,6
1.04867e+18,i applaud and congratulate the u s senate for confirming our great nominee judge brett kavanaugh to the united states supreme court later today i will sign his commission of appointment and he will be officially sworn in very exciting,227222,50090,2018-06-10 20:15:00,2018-06-11 04:15:00,2018-06-11,04:15:00,4,2018,6
1.04867e+18,i have asked steve daines our great republican senator from montana to attend his daughter annies wedding rather than coming to todays vote steve was ready to do whatever he had to but we had the necessary number to the daines family congratulationshave a wonderful day,135409,22519,2018-06-10 20:06:00,2018-06-11 04:06:00,2018-06-11,04:06:00,4,2018,6
1.04858e+18,women for kavanaugh and many others who support this very good man are gathering all over capital hill in preparation for a p m vote it is a beautiful thing to see and they are not paid professional protesters who are handed expensive signs big day for america,56869,15505,2018-06-10 02:40:00,2018-06-10 10:40:00,2018-06-10,10:40:00,10,2018,6
1.04802e+18,beautiful evening in rochester minnesota vote vote vote,60181,12356,2018-05-10 01:03:00,2018-05-10 09:03:00,2018-05-10,09:03:00,9,2018,5
1.04801e+18,thank you minnesota i love you,70940,14305,2018-05-10 00:52:00,2018-05-10 08:52:00,2018-05-10,08:52:00,8,2018,5
1.04798e+18,just made my second stop in minnesota for a make america great again rally we need to elect to the u s senate and we need the strong leadership of and in the u s house,51613,11488,2018-04-10 22:58:00,2018-04-11 06:58:00,2018-04-11,06:58:00,6,2018,4
1.04797e+18,congressman bishop is doing a great job he helped pass tax reform which lowered taxes for everyone nancy pelosi is spending hundreds of thousands of dollars on his opponent because they both support a liberal agenda of higher taxes and wasteful spending,60906,13783,2018-04-10 22:17:00,2018-04-11 06:17:00,2018-04-11,06:17:00,6,2018,4
1.04767e+18,wow such enthusiasm and energy for judge brett kavanaugh look at the energy look at the polls something very big is happening he is a fine man and great intellect the country is with him all the way,135428,30400,2018-04-10 02:23:00,2018-04-10 10:23:00,2018-04-10,10:23:00,10,2018,4
1.04764e+18,my thoughts and prayers are with the florence county sheriffs office and the florence police department tonight in south carolina we are forever grateful for what our law enforcement officers do,73527,16916,2018-04-10 00:01:00,2018-04-10 08:01:00,2018-04-10,08:01:00,8,2018,4
1.04732e+18,thank you mississippi together we are making america great again,43893,8839,2018-03-10 02:58:00,2018-03-10 10:58:00,2018-03-10,10:58:00,10,2018,3
1.04731e+18,today my administration provided historic levels of funding to improve school safety through stop school violence grants a top priority for i am committed to keeping our children safe in their schools,65962,14406,2018-03-10 02:18:00,2018-03-10 10:18:00,2018-03-10,10:18:00,10,2018,3
1.04731e+18,national wage growth is at the highest its been in nearly months and according to a new study released by glassdoor its not expected to slow down anytime soon,44907,10225,2018-03-10 02:15:00,2018-03-10 10:15:00,2018-03-10,10:15:00,10,2018,3
1.0473e+18,god bless the u s a,72927,17193,2018-03-10 01:25:00,2018-03-10 09:25:00,2018-03-10,09:25:00,9,2018,3
1.04729e+18,thank you mississippi i love you,44152,9149,2018-03-10 01:18:00,2018-03-10 09:18:00,2018-03-10,09:18:00,9,2018,3
1.04723e+18,this is really an incredible time for our nation we are respected again,59867,12497,2018-02-10 21:20:00,2018-02-11 05:20:00,2018-02-11,05:20:00,5,2018,2
1.04693e+18,wow thank you tennessee,99795,22064,2018-02-10 00:50:00,2018-02-10 08:50:00,2018-02-10,08:50:00,8,2018,2
1.04692e+18,thank you tennessee i love you,63459,12871,2018-02-10 00:37:00,2018-02-10 08:37:00,2018-02-10,08:37:00,8,2018,2
1.04692e+18,,41022,9865,2018-02-10 00:25:00,2018-02-10 08:25:00,2018-02-10,08:25:00,8,2018,2
1.04672e+18,congratulations to mexico and canada,89141,15291,2018-01-10 10:56:00,2018-01-10 18:56:00,2018-01-10,18:56:00,18,2018,1
1.04671e+18,deficiencies and mistakes in nafta greatly opens markets to our farmers and manufacturers reduces trade barriers to the u s and will bring all three great nations together in competition with the rest of the world the usmca is a historic transaction,68180,14664,2018-01-10 10:53:00,2018-01-10 18:53:00,2018-01-10,18:53:00,18,2018,1
1.04671e+18,deficiencies and mistakes in nafta greatly opens markets to our farmers and manufacturers reduce trade barriers to the u s and will bring all three great nations closer together in competition with the rest of the world the usmca is a historic transaction,6809,1921,2018-01-10 10:40:00,2018-01-10 18:40:00,2018-01-10,18:40:00,18,2018,1
1.04671e+18,late last night our deadline we reached a wonderful new trade deal with canada to be added into the deal already reached with mexico the new name will be the united states mexico canada agreement or usmca it is a great deal for all three countries solves the many,113326,23936,2018-01-10 10:30:00,2018-01-10 18:30:00,2018-01-10,18:30:00,18,2018,1
1.04623e+18,nbc news incorrectly reported as usual that i was limiting the fbi investigation of judge kavanaugh and witnesses only to certain people actually i want them to interview whoever they deem appropriate at their discretion please correct your reporting,139473,37547,2018-09-30 02:49:00,2018-09-30 10:49:00,2018-09-30,10:49:00,10,2018,9
1.0462e+18,thank you west virginia i love you,73041,14353,2018-09-30 00:52:00,2018-09-30 08:52:00,2018-09-30,08:52:00,8,2018,9
1.04614e+18,heading to west virginia now big rally will be live on tonight long lines but will be great,65047,11046,2018-09-29 20:36:00,2018-09-30 04:36:00,2018-09-30,04:36:00,4,2018,9
1.04614e+18,senator richard blumenthal must talk about his fraudulent service in vietnam where for years he told the people of connecticut as their attorney general that he was a great marine war hero talked about his many battles of near death but was never in vietnam total phony,123530,38128,2018-09-29 20:33:00,2018-09-30 04:33:00,2018-09-30,04:33:00,4,2018,9
1.04583e+18,just started tonight our th fbi investigation of judge brett kavanaugh he will someday be recognized as a truly great justice of the united states supreme court,155998,33592,2018-09-29 00:27:00,2018-09-29 08:27:00,2018-09-29,08:27:00,8,2018,9
1.04544e+18,judge kavanaugh showed america exactly why i nominated him his testimony was powerful honest and riveting democrats search and destroy strategy is disgraceful and this process has been a total sham and effort to delay obstruct and resist the senate must vote,281610,69503,2018-09-27 22:46:00,2018-09-28 06:46:00,2018-09-28,06:46:00,6,2018,9
1.0451e+18,,68737,14227,2018-09-26 23:52:00,2018-09-27 07:52:00,2018-09-27,07:52:00,7,2018,9
