id,text,favorites,retweets,date,tweet_datetime,date_part,time_part,hour,year,month
1.00684e+18,just landed a long trip but everybody can now feel much safer than the day i took office there is no longer a nuclear threat from north korea meeting with kim jong un was an interesting and very positive experience north korea has great potential for the future,90701,17825,2018-06-13 09:56:00,2018-06-13 17:56:00,2018-06-13,17:56:00,17,2018,6
1.00684e+18,congratulations to corey stewart for his great victory for senator from virginia now he runs against a total stiff tim kaine who is weak on crime and borders and wants to raise your taxes through the roof dont underestimate corey a major chance of winning,62806,12864,2018-06-13 09:55:00,2018-06-13 17:55:00,2018-06-13,17:55:00,17,2018,6
1.00683e+18,my political representatives didnt want me to get involved in the mark sanford primary thinking that sanford would easily win but with a few hours left i felt that katie was such a good candidate and sanford was so bad i had to give it a shot congrats to katie arrington,53496,9578,2018-06-13 09:37:00,2018-06-13 17:37:00,2018-06-13,17:37:00,17,2018,6
1.00671e+18,a year ago the pundits amp talking heads people that couldnt do the job before were begging for conciliation and peace please meet dont go to war now that we meet and have a great relationship with kim jong un the same haters shout out you shouldnt meet do not meet,108226,24502,2018-06-13 01:14:00,2018-06-13 09:14:00,2018-06-13,09:14:00,9,2018,6
1.00669e+18,the world has taken a big step back from potential nuclear catastrophe no more rocket launches nuclear testing or research the hostages are back home with their families thank you to chairman kim our day together was historic,131430,26412,2018-06-13 00:27:00,2018-06-13 08:27:00,2018-06-13,08:27:00,8,2018,6
1.00669e+18,i want to thank chairman kim for taking the first bold step toward a bright new future for his people our unprecedented meeting the first between an american president and a leader of north korea proves that real change is possible,95918,19322,2018-06-13 00:11:00,2018-06-13 08:11:00,2018-06-13,08:11:00,8,2018,6
9.87821e+17,at least two memos comey shared with a friend contained classified information wall street journal,74953,17332,2018-04-21 22:30:00,2018-04-22 06:30:00,2018-04-22,06:30:00,6,2018,4
1.00669e+18,there is no limit to what noko can achieve when it gives up its nuclear weapons and embraces commerce amp engagement w the world chairman kim has before him the opportunity to be remembered as the leader who ushered in a glorious new era of security amp prosperity for his citizens,71292,14420,2018-06-13 00:02:00,2018-06-13 08:02:00,2018-06-13,08:02:00,8,2018,6
1.00663e+18,mark sanford has been very unhelpful to me in my campaign to maga he is mia and nothing but trouble he is better off in argentina i fully endorse katie arrington for congress in sc a state i love she is tough on crime and will continue our fight to lower taxes vote katie,66694,14670,2018-12-06 20:12:00,2018-12-07 04:12:00,2018-12-07,04:12:00,4,2018,12
1.00645e+18,,156301,40448,2018-12-06 08:02:00,2018-12-06 16:02:00,2018-12-06,16:02:00,16,2018,12
1.00633e+18,our great larry kudlow who has been working so hard on trade and the economy has just suffered a heart attack he is now in walter reed medical center,85514,19846,2018-12-06 00:35:00,2018-12-06 08:35:00,2018-12-06,08:35:00,8,2018,12
1.00633e+18,just won big supreme court decision on voting great news,99255,18272,2018-12-06 00:03:00,2018-12-06 08:03:00,2018-12-06,08:03:00,8,2018,12
1.0063e+18,the fact that i am having a meeting is a major loss for the u s say the haters amp losers we have our hostages testing research and all missle launches have stoped and these pundits who have called me wrong from the beginning have nothing else they can say we will be fine,127810,26867,2018-11-06 22:04:00,2018-11-07 06:04:00,2018-11-07,06:04:00,6,2018,11
1.00629e+18,stock market up almost since the election with trillion dollars of u s value built throughout the economy lowest unemployment rate in many decades with black amp hispanic unemployment lowest in history and female unemployment lowest in years highest confidence ever,119122,25490,2018-11-06 21:52:00,2018-11-07 05:52:00,2018-11-07,05:52:00,5,2018,11
1.00629e+18,meetings between staffs and representatives are going well and quickly but in the end that doesnt matter we will all know soon whether or not a real deal unlike those of the past can happen,89795,16997,2018-11-06 21:27:00,2018-11-07 05:27:00,2018-11-07,05:27:00,5,2018,11
1.00608e+18,thank you prime minister lee hsien loong,74491,15313,2018-11-06 07:51:00,2018-11-06 15:51:00,2018-11-06,15:51:00,15,2018,11
1.006e+18,sorry we cannot let our friends or enemies take advantage of us on trade anymore we must put the american worker first,130726,26430,2018-11-06 02:41:00,2018-11-06 10:41:00,2018-11-06,10:41:00,10,2018,11
1.00599e+18,great to be in singapore excitement in the air,95773,16978,2018-11-06 01:45:00,2018-11-06 09:45:00,2018-11-06,09:45:00,9,2018,11
1.00599e+18,germany pays slowly of gdp towards nato while we pay of a much larger gdp does anybody believe that makes sense we protect europe which is good at great financial loss and then get unfairly clobbered on trade change is coming,118142,26442,2018-11-06 01:42:00,2018-11-06 09:42:00,2018-11-06,09:42:00,9,2018,11
1.00599e+18,and add to that the fact that the u s pays close to the entire cost of natoprotecting many of these same countries that rip us off on trade they pay only a fraction of the costand laugh the european union had a billion surplusshould pay much more for military,89304,20101,2018-11-06 01:29:00,2018-11-06 09:29:00,2018-11-06,09:29:00,9,2018,11
1.00598e+18,why should i as president of the united states allow countries to continue to make massive trade surpluses as they have for decades while our farmers workers amp taxpayers have such a big and unfair price to pay not fair to the people of america billion trade deficit,121646,26786,2018-11-06 01:17:00,2018-11-06 09:17:00,2018-11-06,09:17:00,9,2018,11
1.00598e+18,fair trade is now to be called fool trade if it is not reciprocal according to a canada release they make almost billion dollars in trade with u s guess they were bragging and got caught minimum is b tax dairy from us at then justin acts hurt when called out,89023,21301,2018-11-06 01:05:00,2018-11-06 09:05:00,2018-11-06,09:05:00,9,2018,11
1.00559e+18,pm justin trudeau of canada acted so meek and mild during our meetings only to give a news conference after i left saying that us tariffs were kind of insulting and he will not be pushed around very dishonest amp weak our tariffs are in response to his of on dairy,105700,27539,2018-09-06 23:04:00,2018-09-07 07:04:00,2018-09-07,07:04:00,7,2018,9
1.00559e+18,based on justins false statements at his news conference and the fact that canada is charging massive tariffs to our u s farmers workers and companies i have instructed our u s reps not to endorse the communique as we look at tariffs on automobiles flooding the u s market,111047,26124,2018-09-06 23:03:00,2018-09-07 07:03:00,2018-09-07,07:03:00,7,2018,9
1.00555e+18,the united states will not allow other countries to impose massive tariffs and trade barriers on its farmers workers and companies while sending their product into our country tax free we have put up with trade abuse for many decades and that is long enough,106655,23916,2018-09-06 20:57:00,2018-09-07 04:57:00,2018-09-07,04:57:00,4,2018,9
1.00555e+18,just met the new prime minister of italy a really great guy he will be honored in washington at the shortly he will do a great job the people of italy got it right,73823,16608,2018-09-06 20:43:00,2018-09-07 04:43:00,2018-09-07,04:43:00,4,2018,9
1.00555e+18,henry mcmaster loves the people of south carolina and was with me from the beginning he is strong on crime and borders great for our military and our vets he is doing a fantastic job as your governor and has my full endorsement a special guy vote on tuesday,63352,13687,2018-09-06 20:33:00,2018-09-07 04:33:00,2018-09-07,04:33:00,4,2018,9
1.0053e+18,my thoughts and prayers are with the families of our serviceman who was killed and his fellow servicemen who were wounded in somalia they are truly all heroes,82949,13599,2018-09-06 04:22:00,2018-09-06 12:22:00,2018-09-06,12:22:00,12,2018,9
1.00526e+18,my thoughts and prayers are with the families of our serviceman who was killed and his fellow servicemen who were wounded in somolia they are truly all heroes,47946,10133,2018-09-06 01:24:00,2018-09-06 09:24:00,2018-09-06,09:24:00,9,2018,9
1.00505e+18,i am heading for canada and the g for talks that will mostly center on the long time unfair trade practiced against the united states from there i go to singapore and talks with north korea on denuclearization wont be talking about the russian witch hunt hoax for a while,70307,13984,2018-08-06 11:22:00,2018-08-06 19:22:00,2018-08-06,19:22:00,19,2018,8
1.00505e+18,congratulations to the washington capitals on their great play and winning the stanley cup championship alex ovechkin the team captain was spectacular a true superstar d c is popping in many ways what a time,103397,16568,2018-08-06 11:12:00,2018-08-06 19:12:00,2018-08-06,19:12:00,19,2018,8
1.00503e+18,looking forward to straightening out unfair trade deals with the g countries if it doesnt happen we come out even better,65541,12347,2018-08-06 10:25:00,2018-08-06 18:25:00,2018-08-06,18:25:00,18,2018,8
1.00503e+18,canada charges the u s a tariff on dairy products they didnt tell you that did they not fair to our farmers,80266,20867,2018-08-06 10:16:00,2018-08-06 18:16:00,2018-08-06,18:16:00,18,2018,8
1.00503e+18,obama schumer and pelosi did nothing about north korea and now weak on crime high tax schumer is telling me what to do at the summit the dems could never set up schumer failed with north korea and iran we dont need his advice,97893,23459,2018-08-06 10:06:00,2018-08-06 18:06:00,2018-08-06,18:06:00,18,2018,8
1.00491e+18,why isnt the european union and canada informing the public that for years they have used massive trade tariffs and nonmonetary trade barriers against the u s totally unfair to our farmers workers amp companies take down your tariffs amp barriers or we will more than match you,82815,21381,2018-08-06 02:15:00,2018-08-06 10:15:00,2018-08-06,10:15:00,10,2018,8
1.00487e+18,prime minister trudeau is being so indignant bringing up the relationship that the u s and canada had over the many years and all sorts of other things but he doesnt bring up the fact that they charge us up to on dairy hurting our farmers killing our agriculture,92825,23830,2018-07-06 23:44:00,2018-07-07 07:44:00,2018-07-07,07:44:00,7,2018,7
1.00485e+18,please tell prime minister trudeau and president macron that they are charging the u s massive tariffs and create nonmonetary barriers the eu trade surplus with the u s is billion and canada keeps our farmers and others out look forward to seeing them tomorrow,77840,18763,2018-07-06 22:04:00,2018-07-07 06:04:00,2018-07-07,06:04:00,6,2018,7
1.00482e+18,great day of meetings with prime minister of japan,44121,9456,2018-07-06 20:02:00,2018-07-07 04:02:00,2018-07-07,04:02:00,4,2018,7
1.00475e+18,total jobless claims running at lowest level in years,45,16,2018-07-06 03:48:00,2018-07-06 11:48:00,2018-07-06,11:48:00,11,2018,7
1.00469e+18,isnt it ironic getting ready to go to the g in canada to fight for our country on trade we have the worst trade deals ever made then off to singapore to meet with north korea amp the nuclear problem but back home we still have the angry democrats pushing the witch hunt,71499,16360,2018-07-06 11:57:00,2018-07-06 19:57:00,2018-07-06,19:57:00,19,2018,7
1.00448e+18,thank you to everyone at hq for todays briefing on preparations for the upcoming hurricane season disaster response and recovery is best achieved when its federally supported state managed and locally executed this is the successful model we will continue to build,44407,8777,2018-06-06 21:41:00,2018-06-07 05:41:00,2018-06-07,05:41:00,5,2018,6
1.00446e+18,we must always protect those who protect us today it was my great honor to sign the and to make veterans choice the permanent law of the land,57516,12543,2018-06-06 20:09:00,2018-06-07 04:09:00,2018-06-07,04:09:00,4,2018,6
1.00421e+18,mitch mcconnell announced he will cancel the senates august recess great maybe the democrats will finally get something done other than their acceptance of high crime and high taxes we need border security,74718,15644,2018-06-06 04:02:00,2018-06-06 12:02:00,2018-06-06,12:02:00,12,2018,6
1.00417e+18,the greatest witch hunt in political history,66125,12953,2018-06-06 01:33:00,2018-06-06 09:33:00,2018-06-06,09:33:00,9,2018,6
1.00417e+18,this is a level of criminality beyond the pale this is such a grave abuse of power and authority its like nothing else weve seen in our history this makes the nixon watergate burglary look like keystone cop stuff,73568,17975,2018-06-06 01:27:00,2018-06-06 09:27:00,2018-06-06,09:27:00,9,2018,6
1.00417e+18,chris farrell judicial watch they were running an operation to undermine a candidate for president of the u s these are all violations of law this is intelligence tradecraft to steer an election theres nothing more grave when it comes to abuse of our intelligence system,63682,16522,2018-06-06 01:23:00,2018-06-06 09:23:00,2018-06-06,09:23:00,9,2018,6
1.00417e+18,great interview by with chris farrell of judicial watch concerning the governments counterintelligence operation into the trump campaign spygate at the highest level who would believe,45032,10259,2018-06-06 01:02:00,2018-06-06 09:02:00,2018-06-06,09:02:00,9,2018,6
1.00416e+18,wow strzokpage the incompetent amp corrupt fbi lovers have texts referring to a counterintelligence operation into the trump campaign dating way back to december spygate is in full force is the mainstream media interested yet big stuff,74780,23065,2018-06-06 00:37:00,2018-06-06 08:37:00,2018-06-06,08:37:00,8,2018,6
1.0041e+18,,37204,8056,2018-05-06 20:37:00,2018-05-07 04:37:00,2018-05-07,04:37:00,4,2018,5
1.00409e+18,imagine how much wasteful spending wed save if we didnt have chuck and nancy standing in our way for years democrats in congress have depleted our military and busted our budgets on needless spending and to what end no more,76284,17469,2018-05-06 20:07:00,2018-05-07 04:07:00,2018-05-07,04:07:00,4,2018,5
1.00409e+18,the historic rescissions package weve proposed would cut in wasteful spending we are getting our government back on track,69062,14886,2018-05-06 20:06:00,2018-05-07 04:06:00,2018-05-07,04:06:00,4,2018,5
1.00397e+18,separating families at the border is the fault of bad legislation passed by the democrats border security laws should be changed but the dems cant get their act together started the wall,69787,14960,2018-05-06 11:58:00,2018-05-06 19:58:00,2018-05-06,19:58:00,19,2018,5
1.00397e+18,and champion were recently at the white house it was a great day for a great sport,36367,5986,2018-05-06 11:50:00,2018-05-06 19:50:00,2018-05-06,19:50:00,19,2018,5
1.00396e+18,meeting in singapore with north korea will hopefully be the start of something big we will soon see,67787,12487,2018-05-06 11:34:00,2018-05-06 19:34:00,2018-05-06,19:34:00,19,2018,5
1.00396e+18,the russian witch hunt hoax continues all because jeff sessions didnt tell me he was going to recuse himself i would have quickly picked someone else so much time and money wasted so many lives ruined and sessions knew better than most that there was no collusion,55577,13002,2018-05-06 11:31:00,2018-05-06 19:31:00,2018-05-06,19:31:00,19,2018,5
1.00396e+18,we have had many championship teams recently at the white house including the chicago cubs houston astros pittsburgh penguins new england patriots alabama and clemson national champions and many others national anthem amp more great music today at p m,48130,8733,2018-05-06 11:21:00,2018-05-06 19:21:00,2018-05-06,19:21:00,19,2018,5
1.00396e+18,we will proudly be playing the national anthem and other wonderful music celebrating our country today at p m the white house with the united states marine band and the united states army chorus honoring america nfl no escaping to locker rooms,68873,14197,2018-05-06 11:08:00,2018-05-06 19:08:00,2018-05-06,19:08:00,19,2018,5
1.00395e+18,the u s has an increased economic value of more than trillion dollars since the election may be the best economy in the history of our country record jobs numbers nice,62351,12935,2018-05-06 10:51:00,2018-05-06 18:51:00,2018-05-06,18:51:00,18,2018,5
1.00395e+18,what is taking so long with the inspector generals report on crooked hillary and slippery james comey numerous delays hope report is not being changed and made weaker there are so many horrible things to tell the public has the right to know transparency,71846,18973,2018-05-06 10:38:00,2018-05-06 18:38:00,2018-05-06,18:38:00,18,2018,5
1.00383e+18,the philadelphia eagles football team was invited to the white house unfortunately only a small number of players decided to come and we canceled the event staying in the locker room for the playing of our national anthem is as disrespectful to our country as kneeling sorry,100469,20437,2018-05-06 02:55:00,2018-05-06 10:55:00,2018-05-06,10:55:00,10,2018,5
1.00381e+18,big supreme court ruling for baker just out,58172,9259,2018-05-06 01:10:00,2018-05-06 09:10:00,2018-05-06,09:10:00,9,2018,5
1.00374e+18,in many ways this is the greatest economy in the history of america and the best time ever to look for a job,72176,13879,2018-04-06 20:42:00,2018-04-07 04:42:00,2018-04-07,04:42:00,4,2018,4
1.00374e+18,the fake news media is desperate to distract from the economy and record setting economic numbers and so they keep talking about the phony russian witch hunt,75942,15968,2018-04-06 20:41:00,2018-04-07 04:41:00,2018-04-07,04:41:00,4,2018,4
1.00362e+18,the appointment of the special councel is totally unconstitutional despite that we play the game because i unlike the democrats have done nothing wrong,19339,5277,2018-04-06 01:07:00,2018-04-06 09:07:00,2018-04-06,09:07:00,9,2018,4
1.0036e+18,this is my th day in office and we have accomplished a lot many believe more than any president in his first days massive tax amp regulation cuts military amp vets lower crime amp illegal immigration stronger borders judgeships best economy amp jobs ever and much more,111408,22339,2018-04-06 11:35:00,2018-04-06 19:35:00,2018-04-06,19:35:00,19,2018,4
1.00333e+18,mark penn why are there people from the clinton foundation on the mueller staff why is there an independent councel to go after people and their families for unrelated offenses constitution was set up to prevent this stormtrooper tactics almost a disgrace,6285,1861,2018-03-06 05:25:00,2018-03-06 13:25:00,2018-03-06,13:25:00,13,2018,3
1.00302e+18,when youre almost billion dollars a year down on trade you cant lose a trade war the u s has been ripped off by other countries for years on trade time to get smart,110492,24032,2018-02-06 21:23:00,2018-02-07 05:23:00,2018-02-07,05:23:00,5,2018,2
1.00302e+18,why is it that the wall street journal though well meaning never mentions the unfairness of the tariffs routinely charged against the u s by other countries or the many billions of dollars that the tariffs we are now charging are and will be pouring into u s coffers,68394,15184,2018-02-06 20:57:00,2018-02-07 04:57:00,2018-02-07,04:57:00,4,2018,2
1.00297e+18,there was no collusion with russia except by the democrats when will this very expensive witch hunt hoax ever end so bad for our country is the special councel justice department leaking my lawyers letters to the fake news media should be looking at dems corruption instead,7228,2041,2018-02-06 05:31:00,2018-02-06 13:31:00,2018-02-06,13:31:00,13,2018,2
1.00288e+18,john brennan no single figure in american history has done more to discredit the intelligence community than this liar hes a liar about being a liar,34,21,2018-02-06 11:57:00,2018-02-06 19:57:00,2018-02-06,19:57:00,19,2018,2
1.00288e+18,we ran out of words to describe how good the jobs numbers are neil irwin of the,63206,12913,2018-02-06 11:40:00,2018-02-06 19:40:00,2018-02-06,19:40:00,19,2018,2
1.00267e+18,today it was my great honor to be with the brave men and women of the united states coast guard,71904,12367,2018-01-06 21:40:00,2018-01-07 05:40:00,2018-01-07,05:40:00,5,2018,1
1.00251e+18,looking forward to seeing the employment numbers at this morning,65003,9051,2018-01-06 11:21:00,2018-01-06 19:21:00,2018-01-06,19:21:00,19,2018,1
1.00251e+18,why arent they firing no talent samantha bee for the horrible language used on her low ratings show a total double standard but thats o k we are winning and will be doing so for a long time to come,119416,25194,2018-01-06 11:15:00,2018-01-06 19:15:00,2018-01-06,19:15:00,19,2018,1
1.00251e+18,a p has just reported that the russian hoax investigation has now cost our government over million and going up fast no collusion except by the democrats,83072,20709,2018-01-06 11:05:00,2018-01-06 19:05:00,2018-01-06,19:05:00,19,2018,1
1.0023e+18,fair trade,82331,15584,2018-05-31 21:19:00,2018-06-01 05:19:00,2018-06-01,05:19:00,5,2018,6
1.00216e+18,iger where is my call of apology you and abc have offended millions of people and they demand a response how is brian ross doing he tanked the market with an abc lie yet no apology double standard,84061,19394,2018-05-31 11:53:00,2018-05-31 19:53:00,2018-05-31,19:53:00,19,2018,5
1.00214e+18,rush limbaugh if the fbi was so concerned and if they werent targeting trump they should have told trump if they were really concerned about the russians infiltrating a campaign hoax then why not try to stop it why not tell trump because they were pushing this scam,76430,19358,2018-05-31 10:55:00,2018-05-31 18:55:00,2018-05-31,18:55:00,18,2018,5
1.00203e+18,the recusal of jeff sessions was an unforced betrayal of the president of the united states joe digenova former u s attorney,54681,12580,2018-05-31 03:21:00,2018-05-31 11:21:00,2018-05-31,11:21:00,11,2018,5
1.00202e+18,the soon to be released book the russia hoax the illicit scheme to clear hillary clinton and frame donald trump written by gregg jarrett looks like a real deal big hit the phony witch hunt will be opened up for the world to see out in weeks,69869,17227,2018-05-31 03:06:00,2018-05-31 11:06:00,2018-05-31,11:06:00,11,2018,5
1.00198e+18,very importantly will win for the republicans in november and his opponent will not remember alabama we cant take any chances on losing to a nancy pelosi controlled democrat,47541,10674,2018-05-31 00:08:00,2018-05-31 08:08:00,2018-05-31,08:08:00,8,2018,5
1.00197e+18,there is no one better to represent the people of n y and staten island a place i know very well than who is strong on borders amp crime loves our military amp our vets voted for tax cuts and is helping me to make america great again dan has my full endorsement,44919,9939,2018-05-30 23:46:00,2018-05-31 07:46:00,2018-05-31,07:46:00,7,2018,5
1.00196e+18,great meeting with today talked about prison reform and sentencing,136725,33295,2018-05-30 22:59:00,2018-05-31 06:59:00,2018-05-31,06:59:00,6,2018,5
1.00142e+18,sorry ive got to start focusing my energy on north korea nuclear bad trade deals va choice the economy rebuilding the military and so much more and not on the rigged russia witch hunt that should be investigating clinton russia fbi justice obama comey lynch etc,102930,22849,2018-05-29 11:27:00,2018-05-29 19:27:00,2018-05-29,19:27:00,19,2018,5
1.00142e+18,why arent the angry and heavily conflicted democrats investigating the totally crooked campaign of totally crooked hillary clinton its a rigged witch hunt thats why ask them if they enjoyed her after election celebration,67370,14586,2018-05-29 11:09:00,2018-05-29 19:09:00,2018-05-29,19:09:00,19,2018,5
1.00142e+18,the angry democrats plus people who worked years for obama working on the rigged russia witch hunt will be meddling with the midterm elections especially now that republicans stay tough are taking the lead in polls there was no collusion except by the democrats,83557,18827,2018-05-29 11:00:00,2018-05-29 19:00:00,2018-05-29,19:00:00,19,2018,5
1.00142e+18,this investigation involved far more surveillance than we ever had any idea about it wasnt just a wiretap against a campaign aide it was secretly gathering information on the trump campaign people call that spying this is unprecedented and scandalous mollie hemingway,64442,16115,2018-05-29 10:49:00,2018-05-29 18:49:00,2018-05-29,18:49:00,18,2018,5
1.00141e+18,we have put a great team together for our talks with north korea meetings are currently taking place concerning summit and more kim young chol the vice chairman of north korea heading now to new york solid response to my letter thank you,63540,13458,2018-05-29 10:30:00,2018-05-29 18:30:00,2018-05-29,18:30:00,18,2018,5
1.0014e+18,democrats mistakenly tweet pictures from obamas term showing children from the border in steel cages they thought it was recent pictures in order to make us look bad but backfires dems must agree to wall and new border protection for good of country bipartisan bill,88312,23260,2018-05-29 10:07:00,2018-05-29 18:07:00,2018-05-29,18:07:00,18,2018,5
1.00122e+18,california has a rare opportunity to turn things around and solve its high crime high tax problems along with so many others on june th vote for gop gubernatorial candidate john cox a really good and highly competent man hell make california great again,85335,19572,2018-05-28 21:53:00,2018-05-29 05:53:00,2018-05-29,05:53:00,5,2018,5
