id,text,favorites,retweets,date,tweet_datetime,date_part,time_part,hour,year,month
8.90765e+17,go republican senators go get there after waiting for years give america great healthcare,61281,10718,2017-07-28 02:43:00,2017-07-28 10:43:00,2017-07-28,10:43:00,10,2017,7
8.90706e+17,it was my great honor to present our nations highest award for a public safety officer the medal of valor to five american heroes,53628,10514,2017-07-27 22:49:00,2017-07-28 06:49:00,2017-07-28,06:49:00,6,2017,7
8.90687e+17,today we gathered in the east room to pay tribute to the heroes whose courageous actions under fire saved so many lives in alexandria va,57108,10124,2017-07-27 21:36:00,2017-07-28 05:36:00,2017-07-28,05:36:00,5,2017,7
8.90533e+17,come on republican senators you can do it on healthcare after years this is your chance to shine dont let the american people down,78057,17013,2017-07-27 11:24:00,2017-07-27 19:24:00,2017-07-27,19:24:00,19,2017,7
8.90524e+17,wow the failing said about the most powerful t v show in america,45761,9240,2017-07-27 10:48:00,2017-07-27 18:48:00,2017-07-27,18:48:00,18,2017,7
8.90361e+17,thank you foxconn for investing billion dollars with the potential for up to k new jobs in wisconsin madeintheusa,76852,16945,2017-07-27 00:01:00,2017-07-27 08:01:00,2017-07-27,08:01:00,8,2017,7
8.90314e+17,congratulations to boys and girls nation it was my great honor to welcome you to the wh today full remarks,41777,7904,2017-07-26 20:54:00,2017-07-27 04:54:00,2017-07-27,04:54:00,4,2017,7
8.90168e+17,senator of the great state of alaska really let the republicans and our country down yesterday too bad,49078,11417,2017-07-26 11:13:00,2017-07-26 19:13:00,2017-07-26,19:13:00,19,2017,7
8.90162e+17,the crowd in ohio was amazing last night broke all records we all had a great time in a great state will be back soon,63982,9951,2017-07-26 10:49:00,2017-07-26 18:49:00,2017-07-26,18:49:00,18,2017,7
8.90069e+17,people of ohio are fantastic thank you so much what an evening,46330,8211,2017-07-26 04:40:00,2017-07-26 12:40:00,2017-07-26,12:40:00,12,2017,7
8.9006e+17,it was my great honor to join our wonderful veterans at amvets post in youngstown ohio this evening a grateful nation salutes you,51282,9553,2017-07-26 04:05:00,2017-07-26 12:05:00,2017-07-26,12:05:00,12,2017,7
8.89972e+17,just arrived in youngstown ohio with melania,43938,7349,2017-07-25 22:15:00,2017-07-26 06:15:00,2017-07-26,06:15:00,6,2017,7
8.89801e+17,jared kushner did very well yesterday in proving he did not collude with the russians witch hunt next up year old barron trump,75342,17422,2017-07-25 10:52:00,2017-07-25 18:52:00,2017-07-25,18:52:00,18,2017,7
8.89798e+17,so great that john mccain is coming back to vote brave american hero thank you john,70910,18573,2017-07-25 10:44:00,2017-07-25 18:44:00,2017-07-25,18:44:00,18,2017,7
8.89797e+17,obamacare is torturing the american peoplethe democrats have fooled the people long enough repeal or repeal amp replace i have pen in hand,58370,12920,2017-07-25 10:38:00,2017-07-25 18:38:00,2017-07-25,18:38:00,18,2017,7
8.89794e+17,big day for healthcare after years of talking we will soon see whether or not republicans are willing to step up to the plate,54316,10955,2017-07-25 10:27:00,2017-07-25 18:27:00,2017-07-25,18:27:00,18,2017,7
8.89793e+17,problem is that the acting head of the fbi amp the person in charge of the hillary investigation andrew mccabe got from h for wife,60100,18357,2017-07-25 10:21:00,2017-07-25 18:21:00,2017-07-25,18:21:00,18,2017,7
8.88576e+17,sean spicer is a wonderful person who took tremendous abuse from the fake news media but his future is bright,100632,18151,2017-07-22 01:46:00,2017-07-22 09:46:00,2017-07-22,09:46:00,9,2017,7
8.8979e+17,attorney general jeff sessions has taken a very weak position on hillary clinton crimes where are emails amp dnc server amp intel leakers,59064,15698,2017-07-25 10:12:00,2017-07-25 18:12:00,2017-07-25,18:12:00,18,2017,7
8.89788e+17,ukrainian efforts to sabotage trump campaign quietly working to boost clinton so where is the investigation a g,48611,13943,2017-07-25 10:03:00,2017-07-25 18:03:00,2017-07-25,18:03:00,18,2017,7
8.89676e+17,is fake news washington post being used as a lobbyist weapon against congress to keep politicians from looking into amazon notax monopoly,51439,13335,2017-07-25 02:36:00,2017-07-25 10:36:00,2017-07-25,10:36:00,10,2017,7
8.89674e+17,so many stories about me in the are fake news they are as bad as ratings challenged lobbyist for amazon and taxes,45739,10311,2017-07-25 02:28:00,2017-07-25 10:28:00,2017-07-25,10:28:00,10,2017,7
8.89672e+17,the amazon washington post fabricated the facts on my ending massive dangerous and wasteful payments to syrian rebels fighting assad,48967,11912,2017-07-25 02:23:00,2017-07-25 10:23:00,2017-07-25,10:23:00,10,2017,7
8.89655e+17,remember your duty honor your history take care of the people god puts into your life and love amp cherish your country,60656,15782,2017-07-25 01:13:00,2017-07-25 09:13:00,2017-07-25,09:13:00,9,2017,7
8.89599e+17,any senator who votes against starting debate is telling america that you are fine w the remarks,35778,9319,2017-07-24 21:33:00,2017-07-25 05:33:00,2017-07-25,05:33:00,5,2017,7
8.8958e+17,arriving at joint base andrews with and,38510,8576,2017-07-24 20:15:00,2017-07-25 04:15:00,2017-07-25,04:15:00,4,2017,7
8.89438e+17,after year of investigation with zero evidence being found chuck schumer just stated that democrats should blame ourselves not russia,83349,22500,2017-07-24 10:52:00,2017-07-24 18:52:00,2017-07-24,18:52:00,18,2017,7
8.89435e+17,drain the swamp should be changed to drain the sewer its actually much worse than anyone ever thought and it begins with the fake news,97622,26498,2017-07-24 10:40:00,2017-07-24 18:40:00,2017-07-24,18:40:00,18,2017,7
8.8928e+17,thank you to for giving the first six months of the trump administration an a s c reg cutting stock m jobs border etc true,70045,16218,2017-07-24 00:23:00,2017-07-24 08:23:00,2017-07-24,08:23:00,8,2017,7
8.89274e+17,if republicans dont repeal and replace the disastrous obamacare the repercussions will be far greater than any of them understand,74882,17591,2017-07-24 00:01:00,2017-07-24 08:01:00,2017-07-24,08:01:00,8,2017,7
8.89273e+17,its hard to read the failing new york times or the amazon washington post because every story opinion even if should be positive is bad,58888,12234,2017-07-23 23:57:00,2017-07-24 07:57:00,2017-07-24,07:57:00,7,2017,7
8.89217e+17,its very sad that republicans even some that were carried over the line on my back do very little to protect their president,111163,27879,2017-07-23 20:14:00,2017-07-24 04:14:00,2017-07-24,04:14:00,4,2017,7
8.89216e+17,as the phony russian witch hunt continues two groups are laughing at this excuse for a lost election taking hold democrats and russians,73079,15757,2017-07-23 20:09:00,2017-07-24 04:09:00,2017-07-24,04:09:00,4,2017,7
8.88924e+17,to every patriot who will serve on the keep the watchprotect herdefend herlove hergood luck amp godspeed,93864,21863,2017-07-23 00:50:00,2017-07-23 08:50:00,2017-07-23,08:50:00,8,2017,7
8.88896e+17,american steel amp american hands have constructed a ton message to the world american might is second to none,47541,10554,2017-07-22 22:57:00,2017-07-23 06:57:00,2017-07-23,06:57:00,6,2017,7
8.8873e+17,my son donald openly gave his emails to the media amp authorities whereas crooked hillary clinton deleted amp acid washed her emails,91281,21454,2017-07-22 12:00:00,2017-07-22 20:00:00,2017-07-22,20:00:00,20,2017,7
8.88727e+17,what about all of the clinton ties to russia including podesta company uranium deal russian reset big dollar speeches etc,72420,19758,2017-07-22 11:47:00,2017-07-22 19:47:00,2017-07-22,19:47:00,19,2017,7
8.88726e+17,so many people are asking why isnt the a g or special council looking at the many hillary clinton or comey crimes emails deleted,87301,23242,2017-07-22 11:44:00,2017-07-22 19:44:00,2017-07-22,19:44:00,19,2017,7
8.88724e+17,while all agree the u s president has the complete power to pardon why think of that when only crime so far is leaks against usfake news,60005,13806,2017-07-22 11:35:00,2017-07-22 19:35:00,2017-07-22,19:35:00,19,2017,7
8.88713e+17,this morning i will be going to the commissioning ceremony for the largest aircraft carrier in the world the gerald r ford norfolk va,62269,9572,2017-07-22 10:52:00,2017-07-22 18:52:00,2017-07-22,18:52:00,18,2017,7
8.88711e+17,the failing new york times foiled u s attempt to kill the single most wanted terrorist albaghdaditheir sick agenda over national security,57333,16342,2017-07-22 10:45:00,2017-07-22 18:45:00,2017-07-22,18:45:00,18,2017,7
8.88708e+17,a new intelligence leak from the amazon washington post this time against a g jeff sessionsthese illegal leaks like comeys must stop,60915,15131,2017-07-22 10:33:00,2017-07-22 18:33:00,2017-07-22,18:33:00,18,2017,7
8.88531e+17,today it was my privilege to welcome survivors of the to the,59159,12052,2017-07-21 22:47:00,2017-07-22 06:47:00,2017-07-22,06:47:00,6,2017,7
8.8853e+17,today it was my privilege to welcome survivors of the to the wh remarks,1736,459,2017-07-21 10:42:00,2017-07-21 18:42:00,2017-07-21,18:42:00,18,2017,7
8.8824e+17,billions of dollars in investments amp thousands of new jobs in america an initiative via corning merck amp pfizer,50024,11097,2017-07-21 03:31:00,2017-07-21 11:31:00,2017-07-21,11:31:00,11,2017,7
8.88129e+17,i am asking all citizens to believe in yourselves believe in your future and believe once more in america,103928,28854,2017-07-20 20:08:00,2017-07-21 04:08:00,2017-07-21,04:08:00,4,2017,7
8.87863e+17,melania and i send our thoughts and prayers to senator mccain cindy and their entire family get well soon,71711,12665,2017-07-20 02:33:00,2017-07-20 10:33:00,2017-07-20,10:33:00,10,2017,7
8.87477e+17,the fake news is becoming more and more dishonest even a dinner arranged for top leaders in germany is made to look sinister,90361,21570,2017-07-19 00:59:00,2017-07-19 08:59:00,2017-07-19,08:59:00,8,2017,7
8.87475e+17,fake news story of secret dinner with putin is sick all g leaders and spouses were invited by the chancellor of germany press knew,81092,20977,2017-07-19 00:53:00,2017-07-19 08:53:00,2017-07-19,08:53:00,8,2017,7
8.8728e+17,as i have always said let obamacare fail and then come together and do a great healthcare plan stay tuned,70172,14520,2017-07-18 11:58:00,2017-07-18 19:58:00,2017-07-18,19:58:00,19,2017,7
8.87279e+17,we were let down by all of the democrats and a few republicans most republicans were loyal terrific amp worked really hard we will return,65700,13181,2017-07-18 11:53:00,2017-07-18 19:53:00,2017-07-18,19:53:00,19,2017,7
8.87134e+17,republicans should just repeal failing obamacare now amp work on a new healthcare plan that will start from a clean slate dems will join in,95411,22541,2017-07-18 02:17:00,2017-07-18 10:17:00,2017-07-18,10:17:00,10,2017,7
8.86692e+17,i am at the an amateur player is coleading for the first time in many decades very exciting,43363,5708,2017-07-16 21:00:00,2017-07-17 05:00:00,2017-07-17,05:00:00,5,2017,7
8.86545e+17,with all of its phony unnamed sources amp highly slanted amp even fraudulent reporting news is distorting democracy in our country,79826,18708,2017-07-16 11:15:00,2017-07-16 19:15:00,2017-07-16,19:15:00,19,2017,7
8.86542e+17,thank you to former campaign adviser michael caputo for saying so powerfully that there was no russian collusion in our winning campaign,76651,15508,2017-07-16 11:04:00,2017-07-16 19:04:00,2017-07-16,19:04:00,19,2017,7
8.86539e+17,thank you to all of the supporters who far outnumbered the protesters yesterday at the womens u s open very cool,93980,15269,2017-07-16 10:51:00,2017-07-16 18:51:00,2017-07-16,18:51:00,18,2017,7
8.86535e+17,hillaryclinton can illegally get the questions to the debate amp delete emails but my son don is being scorned by the fake news media,119166,30036,2017-07-16 10:35:00,2017-07-16 18:35:00,2017-07-16,18:35:00,18,2017,7
8.86421e+17,the women played great today at the i look forward to being there tomorrow for the final round,38545,5836,2017-07-16 03:04:00,2017-07-16 11:04:00,2017-07-16,11:04:00,11,2017,7
8.86322e+17,just got to the in bedminster new jersey people are really happy with record high stock market up over since election,55555,9048,2017-07-15 20:29:00,2017-07-16 04:29:00,2017-07-16,04:29:00,4,2017,7
8.86319e+17,make america great again,54525,12230,2017-07-15 20:19:00,2017-07-16 04:19:00,2017-07-16,04:19:00,4,2017,7
8.86058e+17,i will be at the in bedminster nj tomorrow big crowds expected amp the women are playing greatshould be very exciting,42603,6055,2017-07-15 03:02:00,2017-07-15 11:02:00,2017-07-15,11:02:00,11,2017,7
8.86036e+17,honored to serve as commanderinchief to the courageous men and women of our u s armed forces a grateful nation thanks you,95264,18606,2017-07-15 01:34:00,2017-07-15 09:34:00,2017-07-15,09:34:00,9,2017,7
8.85992e+17,president thank you for inviting melania and myself to such a historic celebration in france,67616,15263,2017-07-14 22:39:00,2017-07-15 06:39:00,2017-07-15,06:39:00,6,2017,7
8.85988e+17,just landed from paris france it was an incredible visit with president a lot discussed and accomplished in two days,51594,8306,2017-07-14 22:22:00,2017-07-15 06:22:00,2017-07-15,06:22:00,6,2017,7
8.85817e+17,it was a great honor to represent the united states at the magnificent parade congratulations president,57052,11754,2017-07-14 11:04:00,2017-07-14 19:04:00,2017-07-14,19:04:00,19,2017,7
8.85773e+17,mike pence is working hard on healthcare and getting our wonderful republican senators to do what is right for the people,50805,8966,2017-07-14 08:09:00,2017-07-14 16:09:00,2017-07-14,16:09:00,16,2017,7
8.85773e+17,after all of these years of suffering thru obamacare republican senators must come through as they have promised,62380,12643,2017-07-14 08:07:00,2017-07-14 16:07:00,2017-07-14,16:07:00,16,2017,7
8.85772e+17,so impt rep senators under leadership of mcconnell get healthcare plan approved after yrs of ocare disaster must happen,42132,7768,2017-07-14 08:05:00,2017-07-14 16:05:00,2017-07-14,16:05:00,16,2017,7
8.8577e+17,republicans senators are working hard to get their failed obamacare replacement approved i will be at my desk pen in hand,58848,10937,2017-07-14 07:57:00,2017-07-14 15:57:00,2017-07-14,15:57:00,15,2017,7
8.8577e+17,great evening with president amp mrs macron went to eiffel tower for dinner relationship with france stronger than ever,38278,7053,2017-07-14 07:56:00,2017-07-14 15:56:00,2017-07-14,15:56:00,15,2017,7
8.8541e+17,just landed in paris france with melania,65059,10941,2017-07-13 08:06:00,2017-07-13 16:06:00,2017-07-13,16:06:00,16,2017,7
8.85279e+17,big win today for building the wall it will secure the border amp save lives now the full house amp senate must act,58076,16673,2017-12-07 23:24:00,2017-12-08 07:24:00,2017-12-08,07:24:00,7,2017,12
8.85276e+17,jobs jobs jobs,67179,18340,2017-12-07 23:12:00,2017-12-08 07:12:00,2017-12-08,07:12:00,7,2017,12
8.85274e+17,stock market hits another high with spirit and enthusiasm so positive jobs outlook looking very good,54579,12564,2017-12-07 23:06:00,2017-12-08 07:06:00,2017-12-08,07:06:00,7,2017,12
8.85266e+17,getting rdy to leave for france the invitation of president macron to celebrate amp honor bastille day and yrs since u s entry into wwi,69253,11673,2017-12-07 22:35:00,2017-12-08 06:35:00,2017-12-08,06:35:00,6,2017,12
8.85233e+17,after years u s beef hits chinese market trade deal an exciting opportunity for agriculture,58311,14129,2017-12-07 20:20:00,2017-12-08 04:20:00,2017-12-08,04:20:00,4,2017,12
8.85093e+17,isis is on the run amp will soon be wiped out of syria amp iraq illegal border crossings are way down amp ms gangs are being removed,106122,23283,2017-12-07 11:05:00,2017-12-07 19:05:00,2017-12-07,19:05:00,19,2017,12
8.85085e+17,remember when you hear the words sources say from the fake media often times those sources are made up and do not exist,97163,24507,2017-12-07 10:32:00,2017-12-07 18:32:00,2017-12-07,18:32:00,18,2017,12
8.85081e+17,my son donald did a good job last night he was open transparent and innocent this is the greatest witch hunt in political history sad,100025,20188,2017-12-07 10:19:00,2017-12-07 18:19:00,2017-12-07,18:19:00,18,2017,12
8.84931e+17,my son donald will be interviewed by tonight at p m he is a great person who loves our country,79984,13702,2017-12-07 00:24:00,2017-12-07 08:24:00,2017-12-07,08:24:00,8,2017,12
8.84741e+17,working hard to get the olympics for the united states l a stay tuned,91237,15794,2017-11-07 11:46:00,2017-11-07 19:46:00,2017-11-07,19:46:00,19,2017,11
8.84729e+17,the senate democrats have only confirmed of presidential nominees they cant win so all they do is slow things down amp obstruct,80791,22369,2017-11-07 10:59:00,2017-11-07 18:59:00,2017-11-07,18:59:00,18,2017,11
8.84379e+17,if chelsea clinton were asked to hold the seat for her mother as her mother gave our country away the fake news would say chelsea for pres,89062,20465,2017-10-07 11:47:00,2017-10-07 19:47:00,2017-10-07,19:47:00,19,2017,10
8.84375e+17,when i left conference room for short meetings with japan and other countries i asked ivanka to hold seat very standard angela m agrees,73675,14369,2017-10-07 11:31:00,2017-10-07 19:31:00,2017-10-07,19:31:00,19,2017,10
8.84363e+17,i cannot imagine that congress would dare to leave washington without a beautiful new healthcare bill fully approved and ready to go,85645,18460,2017-10-07 10:47:00,2017-10-07 18:47:00,2017-10-07,18:47:00,18,2017,10
8.84362e+17,james comey leaked classified information to the media that is so illegal,92821,23961,2017-10-07 10:40:00,2017-10-07 18:40:00,2017-10-07,18:40:00,18,2017,10
8.84212e+17,the fact that president putin and i discussed a cyber security unit doesnt mean i think it can happen it cantbut a ceasefire can amp did,75835,15594,2017-10-07 00:45:00,2017-10-07 08:45:00,2017-10-07,08:45:00,8,2017,10
8.84143e+17,syrian ceasefire seems to be holding many lives can be saved came out of meeting good,83120,15825,2017-09-07 20:09:00,2017-09-08 04:09:00,2017-09-08,04:09:00,4,2017,9
8.84142e+17,for years even as a civilian i listened as republicans pushed the repeal and replace of obamacare now they finally have their chance,92026,21123,2017-09-07 20:07:00,2017-09-08 04:07:00,2017-09-08,04:07:00,4,2017,9
8.84019e+17,and safe questions were asked about why the cia amp fbi had to ask the dnc times for their server and were rejected still dont,65381,14874,2017-09-07 11:57:00,2017-09-07 19:57:00,2017-09-07,19:57:00,19,2017,9
8.84017e+17,putin amp i discussed forming an impenetrable cyber security unit so that election hacking amp many other negative things will be guarded,71558,19576,2017-09-07 11:50:00,2017-09-07 19:50:00,2017-09-07,19:50:00,19,2017,9
8.84014e+17,we negotiated a ceasefire in parts of syria which will save lives now it is time to move forward in working constructively with russia,80783,17826,2017-09-07 11:37:00,2017-09-07 19:37:00,2017-09-07,19:37:00,19,2017,9
8.84012e+17,i strongly pressed president putin twice about russian meddling in our election he vehemently denied it ive already given my opinion,69505,15174,2017-09-07 11:31:00,2017-09-07 19:31:00,2017-09-07,19:31:00,19,2017,9
8.84008e+17,the g summit was a great success for the u s explained that the u s must fix the many bad trade deals it has made will get done,67816,13388,2017-09-07 11:15:00,2017-09-07 19:15:00,2017-09-07,19:15:00,19,2017,9
8.83469e+17,great first day with world leaders at the here in hamburg germany looking forward to day two,71096,14842,2017-07-07 23:33:00,2017-07-08 07:33:00,2017-07-08,07:33:00,7,2017,7
8.83445e+17,thank you trumps defining speech wsj editorial,56601,12788,2017-07-07 21:56:00,2017-07-08 05:56:00,2017-07-08,05:56:00,5,2017,7
8.8323e+17,i will represent our country well and fight for its interests fake news media will never cover me accurately but who cares we will,112451,26513,2017-07-07 07:44:00,2017-07-07 15:44:00,2017-07-07,15:44:00,15,2017,7
8.8323e+17,i look forward to all meetings today with world leaders including my meeting with vladimir putin much to discuss,79973,15090,2017-07-07 07:42:00,2017-07-07 15:42:00,2017-07-07,15:42:00,15,2017,7
8.83229e+17,everyone here is talking about why john podesta refused to give the dnc server to the fbi and the cia disgraceful,99079,27412,2017-07-07 07:40:00,2017-07-07 15:40:00,2017-07-07,15:40:00,15,2017,7
8.83221e+17,after poland had a great meeting with chancellor merkel and then with pm shinz abe of japan amp president moon of south korea,63464,10519,2017-07-07 07:07:00,2017-07-07 15:07:00,2017-07-07,15:07:00,15,2017,7
8.83219e+17,my experience yesterday in poland was a great one thank you to everyone including the haters for the great reviews of the speech,106961,20282,2017-07-07 06:59:00,2017-07-07 14:59:00,2017-07-07,14:59:00,14,2017,7
8.83064e+17,a strong poland is a blessing to the nations of europe and a strong europe is a blessing to the west and to the world,98014,25610,2017-06-07 20:45:00,2017-06-08 04:45:00,2017-06-08,04:45:00,4,2017,6
8.82742e+17,congratulations to the dedicated professionals of the usss as they celebrate their nd anniversary thank you,63650,11579,2017-05-07 23:23:00,2017-05-08 07:23:00,2017-05-08,07:23:00,7,2017,5
8.8256e+17,trade between china and north korea grew almost in the first quarter so much for china working with us but we had to give it a try,84258,19181,2017-05-07 11:21:00,2017-05-07 19:21:00,2017-05-07,19:21:00,19,2017,5
8.82558e+17,the united states made some of the worst trade deals in world historywhy should we continue these deals with countries that do not help us,107690,21144,2017-05-07 11:14:00,2017-05-07 19:14:00,2017-05-07,19:14:00,19,2017,5
8.82553e+17,getting ready to leave for poland after which i will travel to germany for the g will be back on saturday,79726,12679,2017-05-07 10:51:00,2017-05-07 18:51:00,2017-05-07,18:51:00,18,2017,5
8.82424e+17,,173909,37880,2017-05-07 02:19:00,2017-05-07 10:19:00,2017-05-07,10:19:00,10,2017,5
8.82187e+17,,97593,24453,2017-04-07 10:38:00,2017-04-07 18:38:00,2017-04-07,18:38:00,18,2017,4
8.82063e+17,and japan will put up with this much longer perhaps china will put a heavy move on north korea and end this nonsense once and for all,95965,23706,2017-04-07 02:24:00,2017-04-07 10:24:00,2017-04-07,10:24:00,10,2017,4
8.82061e+17,north korea has just launched another missile does this guy have anything better to do with his life hard to believe that south korea,122504,39892,2017-04-07 02:19:00,2017-04-07 10:19:00,2017-04-07,10:19:00,10,2017,4
8.81983e+17,dow hit a new intraday alltime high i wonder whether or not the fake news media will so report,94493,19739,2017-03-07 21:10:00,2017-03-08 05:10:00,2017-03-08,05:10:00,5,2017,3
8.81979e+17,really great numbers on jobs amp the economy things are starting to kick in now and we have just begun dont like steel amp aluminum dumping,79684,15846,2017-03-07 20:54:00,2017-03-08 04:54:00,2017-03-08,04:54:00,4,2017,3
8.8184e+17,will be speaking with italy this morning,61147,9319,2017-03-07 11:38:00,2017-03-07 19:38:00,2017-03-07,19:38:00,19,2017,3
8.81835e+17,spoke yesterday with the king of saudi arabia about peace in the middleeast interesting things are happening,71346,17652,2017-03-07 11:19:00,2017-03-07 19:19:00,2017-03-07,19:19:00,19,2017,3
8.8183e+17,will be speaking with germany and france this morning,57693,8865,2017-03-07 11:00:00,2017-03-07 19:00:00,2017-03-07,19:00:00,19,2017,3
8.81697e+17,americas men amp women in uniform is the story of freedom overcoming oppression the strong protecting the weak amp g,87702,20769,2017-03-07 02:13:00,2017-03-07 10:13:00,2017-03-07,10:13:00,10,2017,3
8.81663e+17,stock market at all time high unemployment at lowest level in years wages will start going up and our base has never been stronger,112875,25040,2017-02-07 23:55:00,2017-02-08 07:55:00,2017-02-08,07:55:00,7,2017,2
8.81604e+17,the dishonest media will never keep us from accomplishing our objectives on behalf of our great american people,91685,22077,2017-02-07 20:04:00,2017-02-08 04:04:00,2017-02-08,04:04:00,4,2017,2
8.81374e+17,we will always take care of our great veterans you have shed your blood poured your love and bared your soul in,108386,23954,2017-02-07 04:47:00,2017-02-07 12:47:00,2017-02-07,12:47:00,12,2017,2
8.8092e+17,america will think big once again we will inspire millions of children to carry on the proud tradition of american,71390,15430,2017-06-30 22:43:00,2017-07-01 06:43:00,2017-07-01,06:43:00,6,2017,7
8.80893e+17,the era of strategic patience with the north korea regime has failed that patience is over we are working closely,60368,14098,2017-06-30 20:55:00,2017-07-01 04:55:00,2017-07-01,04:55:00,4,2017,7
8.8074e+17,crime and killings in chicago have reached such epidemic proportions that i am sending in federal help shootings in chicago this year,98715,25433,2017-06-30 10:48:00,2017-06-30 18:48:00,2017-06-30,18:48:00,18,2017,6
8.80737e+17,if republican senators are unable to pass what they are working on now they should immediately repeal and then replace at a later date,77163,19512,2017-06-30 10:37:00,2017-06-30 18:37:00,2017-06-30,18:37:00,18,2017,6
8.80603e+17,just finished a very good meeting with the president of south korea many subjects discussed including north korea and new trade deal,76870,15697,2017-06-30 01:44:00,2017-06-30 09:44:00,2017-06-30,09:44:00,9,2017,6
8.80564e+17,our new american energy policy will unlock millions of jobs amp trillions in wealth we are on the cusp of a true ene,64983,14917,2017-06-29 23:10:00,2017-06-30 07:10:00,2017-06-30,07:10:00,7,2017,6
8.80564e+17,when it comes to the future of americas energy needs we will find it we will dream it and we will build it,46351,9564,2017-06-29 23:09:00,2017-06-30 07:09:00,2017-06-30,07:09:00,7,2017,6
